<?xml version="1.0" encoding="UTF-8"?>


<!DOCTYPE operaciones SYSTEM "fitxer.dtd">

<operaciones>
  <compra>
    <titulo></titulo>
    <proveedor></proveedor>
    <data>
      <dia></dia>
      <mes></mes>
      <año></año>
    </data>
  </compra>
</operaciones>